<?xml version="1.0" encoding="utf-8"?>
<s2files xmlns:xsi="http://www.w3.org/2001/XMLSchema-instance" xsi:noNamespaceSchemaLocation="s2files.xsd">
    <record>
        <id>421</id>
        <defaultValue>0</defaultValue>
    </record>
    <record>
        <id>422</id>
        <defaultValue>0</defaultValue>
    </record>
    <record>
        <id>423</id>
        <defaultValue>0</defaultValue>
    </record>
    <record>
        <id>424</id>
        <defaultValue>0</defaultValue>
    </record>
    <record>
        <id>425</id>
        <defaultValue>0</defaultValue>
    </record>
    <record>
        <id>427</id>
        <defaultValue>0</defaultValue>
        <widget>
			<type>QComboBoxGroup</type>
			<count>4</count>
		</widget>
    </record>
    <record>
        <id>428</id>
        <defaultValue>0</defaultValue>
        <widget>
			<type>QComboBoxGroup</type>
			<count>4</count>
		</widget>
    </record>
</s2files>