<?xml version="1.0" encoding="utf-8"?>
<s2files xmlns:xsi="http://www.w3.org/2001/XMLSchema-instance" xsi:noNamespaceSchemaLocation="s2files.xsd">
    <record>
        <id>101</id>
        <defaultValue>1,1,1,1,1,1,1,1</defaultValue>
    </record>
    <record>
        <id>102</id>
        <defaultValue>4,4,4,4,4,4,4,4</defaultValue>
    </record>
    <record>
        <id>103</id>
        <defaultValue>20,20,20,20,20,20,20,20</defaultValue>
    </record>
    <record>
        <id>104</id>
        <defaultValue></defaultValue>
    </record>
    <record>
        <id>105</id>
        <defaultValue>1000,1000,1000,1000,1000,1000,1000,1000</defaultValue>
    </record>
    <record>
        <id>106</id>
        <defaultValue>10,10,10,10,10,10,10,10</defaultValue>
    </record>
    <record>
        <id>107</id>
        <defaultValue>50,50,50,50,50,50,50,50</defaultValue>
    </record>
    <record>
        <id>108</id>
        <defaultValue>950,950,950,950,950,950,950,950</defaultValue>
    </record>
    <record>
        <id>109</id>
        <defaultValue>990,990,990,990,990,990,990,990</defaultValue>
    </record>
    <record>
        <id>111</id>
        <defaultValue></defaultValue>
    </record>
    <record>
        <id>112</id>
        <defaultValue>2</defaultValue>
    </record>
    <record>
        <id>113</id>
        <defaultValue>16</defaultValue>
    </record>
    <record>
        <id>114</id>
        <defaultValue>5</defaultValue>
    </record>
    <record>
        <id>115</id>
        <defaultValue>5</defaultValue>
    </record>
    <record>
        <id>116</id>
        <defaultValue></defaultValue>
    </record>
    <record>
        <id>117</id>
        <defaultValue></defaultValue>
    </record>
    <record>
        <id>118</id>
        <defaultValue></defaultValue>
    </record>
</s2files>